{
  "schema_version": "1.0.0",
  "trip_id": "balkan-roadtrip-2026",
  "updated_at": "2026-07-12T22:15:00+02:00",
  "description": "Osrednje kazalo povezav med dnevi, aktivnostmi, znamenitostmi, praktičnimi lokacijami in tematskim znanjem.",
  "files": {
    "days": "days.json",
    "activities": "activities.json",
    "attractions": "attractions.json",
    "places": "places.json",
    "knowledge": "knowledge.json",
    "coordinates": "coordinates.json"
  },
  "days": [
    {
      "day": 2,
      "title": "Plitviška jezera",
      "base": "Slunj/Rastoke",
      "overnight": "Slunj/Rastoke",
      "activity_ids": [
        "plitvice-program-h"
      ],
      "optional_activity_ids": [],
      "choose_one_activity_ids": [],
      "attraction_ids": [
        "plitvice-boardwalks",
        "plitvice-boat",
        "plitvice-entrance-2",
        "plitvice-galovacki-buk",
        "plitvice-great-waterfall",
        "plitvice-kozjak",
        "plitvice-lower-lakes",
        "plitvice-supljara",
        "plitvice-train-return",
        "plitvice-upper-lakes"
      ],
      "place_ids": [
        "parking-plitvice-entrance-2",
        "plitvice-entrance-2-info"
      ],
      "knowledge_topic_ids": [
        "karst-and-travertine",
        "plitvice-dynamic-lakes",
        "unesco-on-this-trip"
      ],
      "missing_references": []
    },
    {
      "day": 3,
      "title": "Jajce",
      "base": "Jajce",
      "overnight": "Jajce",
      "activity_ids": [
        "jajce-kings-waterfall-avnoj"
      ],
      "optional_activity_ids": [],
      "choose_one_activity_ids": [],
      "attraction_ids": [
        "jajce-avnoj",
        "jajce-bear-tower",
        "jajce-catacombs",
        "jajce-fortress",
        "jajce-old-town",
        "jajce-st-mary",
        "jajce-waterfall"
      ],
      "place_ids": [],
      "knowledge_topic_ids": [
        "avnoj-and-yugoslavia",
        "bosnian-kingdom",
        "fortifications-and-borderlands",
        "ottoman-urbanism"
      ],
      "missing_references": []
    },
    {
      "day": 5,
      "title": "Sarajevo – zgodovinsko jedro",
      "base": "Sarajevo",
      "overnight": "Sarajevo",
      "activity_ids": [
        "sarajevo-heritage-walk",
        "sarajevo-war-tour"
      ],
      "optional_activity_ids": [],
      "choose_one_activity_ids": [],
      "attraction_ids": [
        "holiday-inn",
        "murdered-children-memorial",
        "nermine-come",
        "presidency-bih",
        "sarajevo-assassination-museum",
        "sarajevo-bascarsija",
        "sarajevo-bezistan",
        "sarajevo-city-hall",
        "sarajevo-clock-tower",
        "sarajevo-emperors-mosque",
        "sarajevo-gazi-husrev-mosque",
        "sarajevo-ghb-library",
        "sarajevo-hotel-europe",
        "sarajevo-inat-kuca",
        "sarajevo-jewish-museum",
        "sarajevo-kazandziluk",
        "sarajevo-kursumlija",
        "sarajevo-latin-bridge",
        "sarajevo-meeting-cultures",
        "sarajevo-morica-han",
        "sarajevo-orthodox-cathedral",
        "sarajevo-rose-war",
        "sarajevo-sacred-heart",
        "sarajevo-sebilj",
        "sarajevo-taslihan",
        "siege-front-line",
        "sniper-alley",
        "war-acrobats"
      ],
      "place_ids": [
        "sarajevo-war-tour-meeting-point"
      ],
      "knowledge_topic_ids": [
        "austro-hungarian-bosnia",
        "ottoman-urbanism",
        "sarajevo-multireligious-city"
      ],
      "missing_references": []
    },
    {
      "day": 6,
      "title": "Sarajevo po navdihu",
      "base": "Sarajevo",
      "overnight": "Sarajevo",
      "activity_ids": [
        "sarajevo-inspiration-day"
      ],
      "optional_activity_ids": [],
      "choose_one_activity_ids": [],
      "attraction_ids": [],
      "place_ids": [],
      "knowledge_topic_ids": [],
      "missing_references": []
    },
    {
      "day": 8,
      "title": "Durmitor",
      "base": "Žabljak",
      "overnight": "Žabljak",
      "activity_ids": [
        "durmitor-lakes-options"
      ],
      "optional_activity_ids": [],
      "choose_one_activity_ids": [
        "durmitor-lakes-options"
      ],
      "attraction_ids": [
        "durmitor-barno",
        "durmitor-black-lake",
        "durmitor-jablan",
        "durmitor-zminje"
      ],
      "place_ids": [
        "crno-jezero-trailhead"
      ],
      "knowledge_topic_ids": [
        "durmitor-glacial-landscape",
        "unesco-on-this-trip"
      ],
      "missing_references": []
    },
    {
      "day": 9,
      "title": "Kanjon Tare",
      "base": "Žabljak",
      "overnight": "Žabljak",
      "activity_ids": [
        "tara-packrafting"
      ],
      "optional_activity_ids": [],
      "choose_one_activity_ids": [],
      "attraction_ids": [],
      "place_ids": [
        "tara-packrafting-meeting-point"
      ],
      "knowledge_topic_ids": [
        "tara-canyon"
      ],
      "missing_references": []
    },
    {
      "day": 10,
      "title": "Durmitor Ring",
      "base": null,
      "overnight": "Perast",
      "activity_ids": [
        "durmitor-ring"
      ],
      "optional_activity_ids": [],
      "choose_one_activity_ids": [],
      "attraction_ids": [
        "durmitor-ring-perast",
        "durmitor-ring-sedlo",
        "durmitor-ring-zabljak"
      ],
      "place_ids": [],
      "knowledge_topic_ids": [
        "durmitor-glacial-landscape",
        "unesco-on-this-trip"
      ],
      "missing_references": []
    },
    {
      "day": 11,
      "title": "Perast in Kotor",
      "base": "Perast",
      "overnight": "Perast",
      "activity_ids": [
        "kotor-city-walls-hike",
        "kotor-old-town-walk",
        "boka-boat-trip"
      ],
      "optional_activity_ids": [
        "boka-boat-trip"
      ],
      "choose_one_activity_ids": [],
      "attraction_ids": [
        "kotor-beskuca-palace",
        "kotor-bizanti-palace",
        "kotor-cat-square",
        "kotor-clock-tower",
        "kotor-first-viewpoint",
        "kotor-karampana",
        "kotor-lady-remedy",
        "kotor-maritime-museum",
        "kotor-north-gate",
        "kotor-pima-palace",
        "kotor-sea-gate",
        "kotor-serpentines",
        "kotor-square-arms",
        "kotor-st-john",
        "kotor-st-luke",
        "kotor-st-mary",
        "kotor-st-nicholas",
        "kotor-st-tryphon",
        "kotor-walls-entrance"
      ],
      "place_ids": [
        "parking-kotor-city"
      ],
      "knowledge_topic_ids": [
        "boka-kotorska-landscape",
        "fortifications-and-borderlands",
        "medieval-adriatic-cities",
        "unesco-on-this-trip",
        "venetian-adriatic"
      ],
      "missing_references": []
    },
    {
      "day": 13,
      "title": "Split",
      "base": "Split",
      "overnight": "Split",
      "activity_ids": [
        "split-diocletian-walk"
      ],
      "optional_activity_ids": [],
      "choose_one_activity_ids": [],
      "attraction_ids": [
        "split-cathedral",
        "split-cellars",
        "split-fruit-square",
        "split-golden-gate",
        "split-gregory",
        "split-jupiter",
        "split-marulic",
        "split-peristyle",
        "split-pjaca",
        "split-prokurative",
        "split-riva",
        "split-sphinx",
        "split-vestibule"
      ],
      "place_ids": [],
      "knowledge_topic_ids": [
        "diocletian-and-christianity",
        "medieval-adriatic-cities",
        "roman-dalmatia",
        "unesco-on-this-trip",
        "venetian-adriatic"
      ],
      "missing_references": []
    },
    {
      "day": 15,
      "title": "Fakultativni izlet",
      "base": "Split",
      "overnight": "Split",
      "activity_ids": [
        "optional-trogir-kastela",
        "optional-salona-klis",
        "optional-krka"
      ],
      "optional_activity_ids": [],
      "choose_one_activity_ids": [
        "optional-trogir-kastela",
        "optional-salona-klis",
        "optional-krka"
      ],
      "attraction_ids": [
        "kastel-gomilica",
        "klis-courtyard",
        "klis-krusic",
        "klis-main-gate",
        "klis-st-vitus",
        "klis-viewpoint",
        "krka-boardwalks",
        "krka-boat",
        "krka-mills",
        "krka-skradin",
        "krka-skradin-return",
        "krka-skradinski-buk",
        "salona-amphitheatre",
        "salona-entrance",
        "salona-forum",
        "salona-manastirine",
        "salona-porta-caesarea",
        "trogir-cathedral",
        "trogir-kamerlengo",
        "trogir-main-square",
        "trogir-north-gate",
        "trogir-riva",
        "trogir-streets"
      ],
      "place_ids": [
        "skradin-boat-departure"
      ],
      "knowledge_topic_ids": [
        "diocletian-and-christianity",
        "fortifications-and-borderlands",
        "karst-and-travertine",
        "medieval-adriatic-cities",
        "roman-dalmatia",
        "unesco-on-this-trip",
        "venetian-adriatic"
      ],
      "missing_references": []
    },
    {
      "day": 16,
      "title": "Zadar",
      "base": null,
      "overnight": "Home",
      "activity_ids": [
        "zadar-express-walk"
      ],
      "optional_activity_ids": [],
      "choose_one_activity_ids": [],
      "attraction_ids": [
        "zadar-cathedral",
        "zadar-five-wells",
        "zadar-forum",
        "zadar-land-gate",
        "zadar-peoples-square",
        "zadar-ravnice",
        "zadar-sea-organ",
        "zadar-st-donatus",
        "zadar-sun-salutation"
      ],
      "place_ids": [
        "parking-zadar-ravnice"
      ],
      "knowledge_topic_ids": [
        "fortifications-and-borderlands",
        "medieval-adriatic-cities",
        "roman-dalmatia",
        "unesco-on-this-trip",
        "venetian-adriatic"
      ],
      "missing_references": []
    }
  ],
  "activity_index": {
    "boka-boat-trip": {
      "type": "boat_trip",
      "status": "draft",
      "trip_day_refs": [
        11
      ],
      "attraction_ids": [],